[
  {
    "category": "Reservoir",
    "category_number": "360102",
    "column_count": 12,
    "company": "NEST",
    "custom_drawing": false,
    "drawing": "static/labware/reservoir/reservoir_row1_col12.svg",
    "image": "",
    "key": "12Well15mL12Channel_NEST_360102",
    "product_name": "12 Well 15mL 12Channel",
    "row_count": 1,
    "shape_bottom": "V",
    "shape_well": "Rectangle",
    "show": false,
    "spec": {
      "bottom_shape": "V",
      "column_count": 12,
      "depth": 26,
      "height": 31,
      "max_volume": 15000,
      "offset_x": 14,
      "offset_y": 12,
      "row_count": 1,
      "space_x": 9,
      "space_y": 0,
      "well_count": 12,
      "well_shape": "Rectangle",
      "well_x": 8.2,
      "well_y": 26.85
    },
    "verified_ablelabs": true,
    "verified_user": false,
    "web_link": "",
    "well_count": 12
  },
  {
    "category": "Well Plate",
    "category_number": "30012",
    "column_count": 4,
    "company": "SPL",
    "custom_drawing": false,
    "drawing": "static/labware/wellplate/wellplate_12_circle.svg",
    "image": "",
    "key": "12Well2mL_SPL_30012",
    "product_name": "12 Well 2mL",
    "row_count": 3,
    "shape_bottom": "Flat",
    "shape_well": "Circle",
    "show": false,
    "spec": {
      "bottom_shape": "Flat",
      "column_count": 4,
      "depth": 17.5,
      "height": 20.2,
      "max_volume": 2000,
      "offset_x": 24.8,
      "offset_y": 16.7,
      "row_count": 3,
      "space_x": 26,
      "space_y": 26,
      "well_count": 12,
      "well_shape": "Circle",
      "well_x": 22.1,
      "well_y": 22.1
    },
    "verified_ablelabs": false,
    "verified_user": false,
    "web_link": "",
    "well_count": 12
  },
  {
    "category": "Well Plate",
    "category_number": "31012",
    "column_count": 4,
    "company": "SPL",
    "custom_drawing": false,
    "drawing": "static/labware/wellplate/wellplate_12_circle.svg",
    "image": "",
    "key": "12Well2mL_SPL_31012",
    "product_name": "12 Well 2mL",
    "row_count": 3,
    "shape_bottom": "Flat",
    "shape_well": "Circle",
    "show": false,
    "spec": {
      "bottom_shape": "Flat",
      "column_count": 4,
      "depth": 17.5,
      "height": 20.2,
      "max_volume": 2000,
      "offset_x": 24.8,
      "offset_y": 16.7,
      "row_count": 3,
      "space_x": 26,
      "space_y": 26,
      "well_count": 12,
      "well_shape": "Circle",
      "well_x": 22.1,
      "well_y": 22.1
    },
    "verified_ablelabs": false,
    "verified_user": false,
    "web_link": "",
    "well_count": 12
  },
  {
    "category": "Well Plate",
    "category_number": "32012",
    "column_count": 4,
    "company": "SPL",
    "custom_drawing": false,
    "drawing": "static/labware/wellplate/wellplate_12_circle.svg",
    "image": "",
    "key": "12Well2mL_SPL_32012",
    "product_name": "12 Well 2mL",
    "row_count": 3,
    "shape_bottom": "Flat",
    "shape_well": "Circle",
    "show": false,
    "spec": {
      "bottom_shape": "Flat",
      "column_count": 4,
      "depth": 17.5,
      "height": 20.2,
      "max_volume": 2000,
      "offset_x": 24.8,
      "offset_y": 16.7,
      "row_count": 3,
      "space_x": 26,
      "space_y": 26,
      "well_count": 12,
      "well_shape": "Circle",
      "well_x": 22.1,
      "well_y": 22.1
    },
    "verified_ablelabs": false,
    "verified_user": false,
    "web_link": "",
    "well_count": 12
  },
  {
    "category": "Well Plate",
    "category_number": "3336",
    "column_count": 4,
    "company": "Corning",
    "custom_drawing": false,
    "drawing": "static/labware/wellplate/wellplate_12_circle.svg",
    "image": "",
    "key": "12Well6.9mL_Corning_3336",
    "product_name": "12 Well 6.9mL",
    "row_count": 3,
    "shape_bottom": "Flat",
    "shape_well": "Circle",
    "show": false,
    "spec": {
      "bottom_shape": "Flat",
      "column_count": 4,
      "depth": 17.53,
      "height": 20.02,
      "max_volume": 6900,
      "offset_x": 24.94,
      "offset_y": 16.79,
      "row_count": 3,
      "space_x": 26.01,
      "space_y": 26.01,
      "well_count": 12,
      "well_shape": "Circle",
      "well_x": 85.6,
      "well_y": 20.02
    },
    "verified_ablelabs": false,
    "verified_user": false,
    "web_link": "",
    "well_count": 12
  },
  {
    "category": "Well Plate",
    "category_number": "3512",
    "column_count": 4,
    "company": "Corning",
    "custom_drawing": false,
    "drawing": "static/labware/wellplate/wellplate_12_circle.svg",
    "image": "",
    "key": "12Well6.9mL_Corning_3512",
    "product_name": "12 Well 6.9mL",
    "row_count": 3,
    "shape_bottom": "Flat",
    "shape_well": "Circle",
    "show": false,
    "spec": {
      "bottom_shape": "Flat",
      "column_count": 4,
      "depth": 17.53,
      "height": 20.02,
      "max_volume": 6900,
      "offset_x": 24.94,
      "offset_y": 16.79,
      "row_count": 3,
      "space_x": 26.01,
      "space_y": 26.01,
      "well_count": 12,
      "well_shape": "Circle",
      "well_x": 85.6,
      "well_y": 20.02
    },
    "verified_ablelabs": false,
    "verified_user": false,
    "web_link": "",
    "well_count": 12
  },
  {
    "category": "Well Plate",
    "category_number": "3513",
    "column_count": 4,
    "company": "Corning",
    "custom_drawing": false,
    "drawing": "static/labware/wellplate/wellplate_12_circle.svg",
    "image": "",
    "key": "12Well6.9mL_Corning_3513",
    "product_name": "12 Well 6.9mL",
    "row_count": 3,
    "shape_bottom": "Flat",
    "shape_well": "Circle",
    "show": false,
    "spec": {
      "bottom_shape": "Flat",
      "column_count": 4,
      "depth": 17.53,
      "height": 20.02,
      "max_volume": 6900,
      "offset_x": 24.94,
      "offset_y": 16.79,
      "row_count": 3,
      "space_x": 26.01,
      "space_y": 26.01,
      "well_count": 12,
      "well_shape": "Circle",
      "well_x": 85.6,
      "well_y": 20.02
    },
    "verified_ablelabs": false,
    "verified_user": false,
    "web_link": "",
    "well_count": 12
  },
  {
    "category": "Reservoir",
    "category_number": "1061-8150",
    "column_count": 12,
    "company": "USA Scientific",
    "custom_drawing": false,
    "drawing": "static/labware/reservoir/reservoir_row1_col12.svg",
    "image": "",
    "key": "12WellReservoir22mL_USAScientific_1061-8150",
    "product_name": " 12 Well Reservoir 22mL",
    "row_count": 1,
    "shape_bottom": "V",
    "shape_well": "Rectangle",
    "show": false,
    "spec": {
      "bottom_shape": "V",
      "column_count": 12,
      "depth": 42.16,
      "height": 44.45,
      "max_volume": 22000,
      "offset_x": 13.94,
      "offset_y": 42.9,
      "row_count": 1,
      "space_x": 9.09,
      "space_y": 0,
      "well_count": 12,
      "well_shape": "Rectangle",
      "well_x": 85.8,
      "well_y": 44.45
    },
    "verified_ablelabs": false,
    "verified_user": false,
    "web_link": "",
    "well_count": 12
  },
  {
    "category": "Tube Rack",
    "category_number": "ABLELabs_CF-01",
    "column_count": 5,
    "company": "ABLELabs",
    "custom_drawing": false,
    "drawing": "static/labware/tuberack/tuberack_15.svg",
    "image": "",
    "key": "15ConicalTube15mL_ABLELabs_CF-01",
    "product_name": "15 Conical Tube 15mL",
    "row_count": 3,
    "shape_bottom": "V",
    "shape_well": "Circle",
    "show": false,
    "spec": {
      "offset_x": 15,
      "offset_y": 18,
      "space_x": 23,
      "space_y": 28,
      "well_count": 15,
      "row_count": 3,
      "column_count": 5,
      "height": 121,
      "depth": 119,
      "well_shape": "Circle",
      "bottom_shape": "V",
      "max_volume": 15000,
      "well_x": 14.9,
      "well_y": 14.9
    },
    "verified_ablelabs": false,
    "verified_user": false,
    "web_link": "",
    "well_count": 15
  },
  {
    "category": "Tube Rack",
    "category_number": "CR-glass-01",
    "column_count": 5,
    "company": "ABLELabs",
    "custom_drawing": false,
    "drawing": "static/labware/tuberack/tuberack_15.svg",
    "image": "",
    "key": "15glasstube15mL_CR-glass-01",
    "product_name": "15 glass tube 15mL",
    "row_count": 3,
    "shape_bottom": "V",
    "shape_well": "Circle",
    "show": false,
    "spec": {
      "offset_x": 18.5,
      "offset_y": 15,
      "space_x": 23,
      "space_y": 28,
      "well_count": 15,
      "row_count": 3,
      "column_count": 5,
      "height": 101,
      "depth": 99,
      "well_shape": "Circle",
      "bottom_shape": "U",
      "max_volume": 15000,
      "well_x": 13.5,
      "well_y": 13.5
    },
    "verified_ablelabs": false,
    "verified_user": false,
    "web_link": "",
    "well_count": 15
  },
  {
    "category": "Reservoir",
    "category_number": "30001",
    "column_count": 1,
    "company": "SPL",
    "custom_drawing": false,
    "drawing": "static/labware/reservoir/reservoir_row1_col1.svg",
    "image": "",
    "key": "1Well60mLOmniTray_SPL_30001",
    "product_name": "1 Well 60mL OmniTray",
    "row_count": 1,
    "shape_bottom": "Flat",
    "shape_well": "Rectangle",
    "show": false,
    "spec": {
      "bottom_shape": "Flat",
      "column_count": 1,
      "depth": 11,
      "height": 15,
      "max_volume": 60000,
      "offset_x": 14.5,
      "offset_y": 9.5,
      "row_count": 1,
      "space_x": 0,
      "space_y": 0,
      "well_count": 1,
      "well_shape": "Rectangle",
      "well_x": 109.7,
      "well_y": 73.46
    },
    "verified_ablelabs": false,
    "verified_user": false,
    "web_link": "",
    "well_count": 1
  },
  {
    "category": "Reservoir",
    "category_number": "360103",
    "column_count": 1,
    "company": "NEST",
    "custom_drawing": false,
    "drawing": "static/labware/reservoir/reservoir_row1_col1.svg",
    "image": "",
    "key": "1WellReservoir195mL_NEST_360103",
    "product_name": "1 Well Reservoir 195mL",
    "row_count": 1,
    "shape_bottom": "V",
    "shape_well": "Rectangle",
    "show": false,
    "spec": {
      "bottom_shape": "V",
      "column_count": 1,